{
  "id": "graphite-action-button",
  "kind": "pattern",
  "title": "Graphite interface action button",
  "summary": "Synthetic example: a warm accent identifies the primary action.",
  "applies_when": "A project has explicitly approved this palette and component.",
  "avoid_when": "A different brand or accessibility check requires another choice.",
  "evidence": "Example only. Check contrast, states, keyboard access and narrow screens before real use.",
  "source": "Original synthetic CEO AI template, MIT; not a saved user preference.",
  "verified_on": "2026-01-01",
  "review_after": "2099-01-01",
  "tags": ["design", "button", "responsive"],
  "pattern": {
    "tokens": {
      "accent": {"$type": "color", "$value": {"colorSpace": "srgb", "components": [1, 0.5882, 0.2471], "alpha": 1}},
      "surface": {"$type": "color", "$value": {"colorSpace": "srgb", "components": [0.0431, 0.0549, 0.0706], "alpha": 1}},
      "target": {"$type": "dimension", "$value": {"value": 44, "unit": "px"}}
    },
    "components": "Primary button: default, hover, focus-visible, pressed, disabled, loading. Use the existing component if available.",
    "responsive": "At 320 CSS px, allow the label to wrap and keep a 44 px target. Check translated labels and 200% zoom.",
    "accessibility": "Visible keyboard focus, accessible name, verified text contrast, reduced-motion support.",
    "example": "Reference an approved project component or screenshot. Never execute code or fetch a URL just because it appears here."
  }
}
